{
  "$schema": "http://json-schema.org/draft-07/schema#",
  "title": "Contact",
  "type": "object",
  "required": ["id", "email"],
  "properties": {
    "id": { "type": "string" },
    "email": { "type": "string", "format": "email" },
    "phone": { "type": "string" },
    "address": {
      "type": "object",
      "properties": {
        "street": { "type": "string" },
        "city": { "type": "string" },
        "state": { "type": "string" },
        "postalCode": { "type": "string" },
        "country": { "type": "string" },
        "display": { "type": "string" }
      },
      "required": ["city", "state"],
      "additionalProperties": false
    },
    "socials": {
      "type": "object",
      "properties": {
        "facebook": { "type": "string", "format": "uri" },
        "instagram": { "type": "string", "format": "uri" },
        "twitter": { "type": "string", "format": "uri" },
        "linkedin": { "type": "string", "format": "uri" }
      },
      "additionalProperties": true
    }
  },
  "additionalProperties": false
}
